{
  "id": "factory-sultans-of-swing",
  "name": "Sultans of Swing - Inspired Tone (Factory)",
  "description": "Generated from: \"Sultans of Swing\"",
  "author": "ToneForge AI",
  "schemaVersion": 1,
  "tags": [],
  "favorite": false,
  "chain": [
    {
      "moduleId": "noise_gate.v1",
      "bypassed": false,
      "parameters": {
        "threshold_db": -54.0,
        "attack_ms": 2.0,
        "hold_ms": 84.0,
        "release_ms": 172.0
      },
      "resourceRef": null
    },
    {
      "moduleId": "compressor.v1",
      "bypassed": false,
      "parameters": {
        "ratio": 3.775,
        "threshold_db": -12.3,
        "attack_ms": 5.0,
        "release_ms": 80.0,
        "makeup_db": 2.0999999999999996
      },
      "resourceRef": null
    },
    {
      "moduleId": "drive.v1",
      "bypassed": false,
      "parameters": {
        "gain_db": 4.0,
        "tone": 0.6900000000000001,
        "level_db": -3.0
      },
      "resourceRef": null
    },
    {
      "moduleId": "amp.v1",
      "bypassed": false,
      "parameters": {
        "gain": 0.265,
        "bass": 0.47,
        "mid": 0.5,
        "treble": 0.61,
        "presence": 0.56
      },
      "resourceRef": "amp_model.generic_tube_v1"
    },
    {
      "moduleId": "cab.v1",
      "bypassed": false,
      "parameters": {
        "mix": 1.0
      },
      "resourceRef": "cab_ir.generic_4x12_v1"
    },
    {
      "moduleId": "eq.v1",
      "bypassed": false,
      "parameters": {
        "low_gain_db": -0.9500000000000002,
        "mid_gain_db": 0.0,
        "high_gain_db": 1.25
      },
      "resourceRef": null
    },
    {
      "moduleId": "modulation.v1",
      "bypassed": true,
      "parameters": {
        "rate_hz": 1.2,
        "depth": 0.1,
        "mix": 0.15
      },
      "resourceRef": null
    },
    {
      "moduleId": "delay.v1",
      "bypassed": false,
      "parameters": {
        "time_ms": 380.0,
        "feedback": 0.165,
        "mix": 0.115
      },
      "resourceRef": null
    },
    {
      "moduleId": "reverb.v1",
      "bypassed": false,
      "parameters": {
        "size": 0.29000000000000004,
        "decay_s": 1.205,
        "mix": 0.128
      },
      "resourceRef": null
    },
    {
      "moduleId": "limiter.v1",
      "bypassed": false,
      "parameters": {
        "ceiling_db": -0.3,
        "release_ms": 50.0
      },
      "resourceRef": null
    }
  ],
  "aiProvenance": {
    "provider": "song_reference",
    "prompt": "Sultans of Swing",
    "matchType": "song_curated",
    "confidence": 1.0,
    "disclaimer": "Inspired by - approximation, not an exact recreation."
  },
  "createdAt": "2026-07-27T00:00:00Z"
}